{
  "schema_version": 4,
  "id": "crypt-warden",
  "name": "Crypt Warden",
  "max_hp": 40,
  "xp_reward": 40,
  "attack_id": "attack.crypt-warden",
  "aggressive": true,
  "tags": ["undead", "fearless"],
  "spawn_room_id": "warden-chamber",
  "max_count": 1,
  "respawn_ticks": 60,
  "loot": [
    {
      "item_id": "crypt-key",
      "drop_chance": 0.8
    },
    {
      "item_id": "catacombs-map",
      "drop_chance": 0.5
    }
  ],
  "gold_drop": {
    "min": 10,
    "max": 25
  }
}
