{
  "schema_version": 4,
  "id": "enchanter",
  "name": "Sella the Runesmith",
  "max_hp": 9999,
  "xp_reward": 0,
  "attack_id": null,
  "aggressive": false,
  "tags": ["npc", "shopkeeper", "enchanter"],
  "spawn_room_id": "courtyard",
  "max_count": 1,
  "respawn_ticks": 0,
  "loot": [],
  "dialogue_id": "sella-enchanter-welcome"
}
