{
  "schema_version": 4,
  "id": "cook",
  "name": "Old Mira the Cook",
  "max_hp": 9999,
  "attack_id": null,
  "aggressive": false,
  "tags": ["npc", "shopkeeper", "cook"],
  "spawn_room_id": "courtyard",
  "max_count": 1,
  "respawn_ticks": 0,
  "loot": [],
  "dialogue_id": "mira-cook-welcome"
}
