{
  "schema_version": 4,
  "id": "void-wraith",
  "name": "a void wraith",
  "max_hp": 320,
  "attack_id": "attack.void-wraith",
  "aggressive": true,
  "tags": ["void", "spirit", "voidscar"],
  "spawn_room_id": "voidscar-lightless-expanse",
  "max_count": 2,
  "respawn_ticks": 60,
  "xp_reward": 360,
  "loot": [
    {
      "item_id": "voidglass-shard",
      "drop_chance": 0.4
    },
    {
      "item_id": "voidchill-amulet",
      "drop_chance": 0.2
    }
  ],
  "gold_drop": {
    "min": 70,
    "max": 120
  }
}
