{
  "schema_version": 4,
  "id": "tanner",
  "name": "Della the Tanner",
  "max_hp": 9999,
  "xp_reward": 0,
  "attack_id": null,
  "aggressive": false,
  "tags": ["npc", "shopkeeper", "leatherworker"],
  "spawn_room_id": "tangled-undergrowth",
  "max_count": 1,
  "respawn_ticks": 0,
  "loot": [],
  "dialogue_id": "della-tanner-welcome"
}
